usummary_code,HS_total_imports,TiVA_total_imports,difference,usummary_name
111,1492346031.0,1651000000,-158653969.0,Crop production
112,2257917567.0,2365000000,-107082433.0,Animal production and aquaculture
113FF,2148090905.0,2369000000,-220909095.0,"Forestry, fishing, and related activities"
211,3117983849.0,2388000000,729983849.0,Oil and gas extraction
212,535017184.0,570000000,-34982816.0,"Mining, except oil and gas"
213,0.0,173000000,-173000000.0,Support activities for mining
2211,0.0,39000000,-39000000.0,"Electric power generation, transmission, and distribution"
2212NW,0.0,0,0.0,"Natural gas distribution and water, sewage and other systems"
23EH,0.0,0,0.0,"Education, hospital, and health structures"
23MR,0.0,0,0.0,Maintenance and repair construction
23OC,0.0,0,0.0,Office and commercial structures
23OR,0.0,0,0.0,Other residential construction
23OT,0.0,0,0.0,Other nonresidential structures
23PC,0.0,0,0.0,Power and communication structures
23SF,0.0,0,0.0,Single-family residential structures
23TH,0.0,0,0.0,Transportation structures and highways and streets
311,23125187264.0,22088000000,1037187264.0,Food manufacturing
3121,13708129221.0,13987000000,-278870779.0,Beverage manufacturing
3122,142091732.0,125000000,17091732.0,Tobacco manufacturing
313TT,4526323964.0,4752000000,-225676036.0,Textile mills and textile product mills
315AL,11425067469.0,13849000000,-2423932531.0,Apparel and leather and allied products
321,3092610099.0,3598000000,-505389901.0,Wood products
322,5285599189.0,5231000000,54599189.0,Paper products
323,1260406949.0,393000000,867406949.0,Printing and related support activities
324,15684368941.0,18252000000,-2567631059.0,Petroleum and coal products
3251,28317647887.0,27968000000,349647887.0,Basic chemical manufacturing
3252,5793650253.0,6124000000,-330349747.0,"Resin, rubber, and artificial fibers manufacturing"
3254,185653062994.0,134155000000,51498062994.0,Pharmaceutical and medicine manufacturing
325X,16244447308.0,14700000000,1544447308.0,Other chemical manufacturing
326,10457312323.0,10389000000,68312323.0,Plastics and rubber products
327,7599167672.0,8972000000,-1372832328.0,Nonmetallic mineral products
3311IS,9484364302.0,11507000000,-2022635698.0,Iron and steel mills and manufacturing from purchased steel
3313NF,24505794707.0,11370000000,13135794707.0,Nonferrous metal production and processing and foundries
332,23315815748.0,20072000000,3243815748.0,Fabricated metal products
33311,5873138635.0,7412000000,-1538861365.0,Agricultural implement manufacturing
33312,10385600235.0,12217000000,-1831399765.0,Construction machinery manufacturing
33313,1287808170.0,1575000000,-287191830.0,Mining and oil and gas field machinery manufacturing
3332OM,67769019765.0,61632000000,6137019765.0,Other machinery
3341,3914608258.0,2650000000,1264608258.0,Computer and peripheral equipment manufacturing
3342,4142138664.0,2178000000,1964138664.0,Communications equipment manufacturing
3344,10426562313.0,6612000000,3814562313.0,Semiconductor and other electronic component manufacturing
3345,32103434572.0,26860000000,5243434572.0,"Navigational, measuring, electromedical, and control instruments manufacturing"
334X,2319558966.0,1696000000,623558966.0,Other computer and electronic product manufacturing
335,27734149003.0,22143000000,5591149003.0,"Electrical equipment, appliances, and components"
336111,53708177586.0,23055000000,30653177586.0,Automobile manufacturing
336112,227838500.0,31877000000,-31649161500.0,Light truck and utility vehicle manufacturing
33612,662448428.0,1206000000,-543551572.0,Heavy duty truck manufacturing
3362BP,17923696045.0,18701000000,-777303955.0,"Motor vehicle body, trailer, and parts manufacturing"
3364,33675598580.0,15167000000,18508598580.0,Aerospace product and parts manufacturing
3365AO,3673793721.0,5813000000,-2139206279.0,All other transportation equipment manufacturing
337,5181829080.0,5158000000,23829080.0,Furniture and related products
3391,19952469362.0,17044000000,2908469362.0,Medical equipment and supplies manufacturing
3399,12583048163.0,6956000000,5627048163.0,Other miscellaneous manufacturing
4231,0.0,0,0.0,Motor vehicle and motor vehicle parts and supplies
4234,0.0,0,0.0,Professional and commercial equipment and supplies
4236,0.0,0,0.0,Household appliances and electrical and electronic goods
4238,0.0,0,0.0,"Machinery, equipment, and supplies"
423X,0.0,0,0.0,Other durable goods merchant wholesalers
4242,0.0,0,0.0,Drugs and druggists' sundries
4244,0.0,0,0.0,Grocery and related product wholesalers
4247,0.0,0,0.0,Petroleum and petroleum products
424X,0.0,0,0.0,Other nondurable goods merchant wholesalers
425,0.0,0,0.0,Wholesale electronic markets and agents and brokers
42ID,0.0,0,0.0,Customs duties
441,0.0,0,0.0,Motor vehicle and parts dealers
444,0.0,0,0.0,Building material and garden equipment and supplies dealers
445,0.0,0,0.0,Food and beverage stores
446,0.0,0,0.0,Health and personal care stores
447,0.0,0,0.0,Gasoline stations
448,0.0,0,0.0,Clothing and clothing accessories stores
452,0.0,0,0.0,General merchandise stores
454,0.0,0,0.0,Nonstore retailers
481,0.0,28693000000,-28693000000.0,Air transportation
482,0.0,0,0.0,Rail transportation
483,0.0,0,0.0,Water transportation
484,0.0,0,0.0,Truck transportation
485,0.0,0,0.0,Transit and ground passenger transportation
486,0.0,0,0.0,Pipeline transportation
48A,0.0,0,0.0,Scenic and sightseeing transportation and support activities
492,0.0,0,0.0,Couriers and messengers
493,0.0,0,0.0,Warehousing and storage
4A0X,0.0,0,0.0,All other retail
5111,0.0,999000000,-999000000.0,"Newspaper, periodical, book, and directory publishers"
5112,0.0,843000000,-843000000.0,Software publishers
512,0.0,7490000000,-7490000000.0,Motion picture and sound recording industries
515,0.0,0,0.0,Broadcasting (except internet)
5171,0.0,23000000,-23000000.0,Wired telecommunications carriers
5172,0.0,0,0.0,Wireless telecommunications carriers (except satellite)
5174OT,0.0,1000000,-1000000.0,"Other telecommunications, including satellite"
518,0.0,279000000,-279000000.0,"Data processing, hosting, and related services"
519,0.0,617000000,-617000000.0,Other information services
521CI,0.0,5668000000,-5668000000.0,"Federal reserve banks, credit intermediation, and related activities"
523,0.0,6000000,-6000000.0,"Securities, commodity contracts, and investments"
524113,0.0,0,0.0,Direct life insurance carriers
5241X,0.0,22073000000,-22073000000.0,"Insurance carriers, except direct life"
5242,0.0,0,0.0,"Agencies, brokerages, and other insurance related activities"
525,0.0,0,0.0,"Funds, trusts, and other financial vehicles"
532RL,0.0,0,0.0,Rental and leasing services and lessors of intangible assets
5411,0.0,3244000000,-3244000000.0,Legal services
5412,0.0,3996000000,-3996000000.0,"Accounting, tax preparation, bookkeeping, and payroll services"
5413,0.0,5013000000,-5013000000.0,"Architectural, engineering, and related services"
5415,0.0,18044000000,-18044000000.0,Computer systems design and related services
5416,0.0,24621000000,-24621000000.0,"Management, scientific, and technical consulting services"
5417,0.0,14433000000,-14433000000.0,Scientific research and development services
5418,0.0,5566000000,-5566000000.0,"Advertising, public relations, and related services"
541X,0.0,2477000000,-2477000000.0,"Specialized design services and other professional, scientific, and technical services"
55,0.0,0,0.0,Management of companies and enterprises
5613,0.0,1354000000,-1354000000.0,Employment services
5617,0.0,0,0.0,Services to buildings and dwellings
561X,0.0,290000000,-290000000.0,Other administrative and support services
562,0.0,189000000,-189000000.0,Waste management and remediation services
61,0.0,696000000,-696000000.0,Educational services
6211,0.0,11000000,-11000000.0,Offices of physicians
6212,0.0,11000000,-11000000.0,Offices of dentists
6213,0.0,11000000,-11000000.0,Offices of other health practitioners
6214,0.0,11000000,-11000000.0,Outpatient care centers
6215OH,0.0,32000000,-32000000.0,Other ambulatory health care services
622,0.0,3794000000,-3794000000.0,Hospitals
623,0.0,21000000,-21000000.0,Nursing and residential care facilities
624,0.0,0,0.0,Social assistance
711AS,0.0,635000000,-635000000.0,"Performing arts, spectator sports, museums, and related activities"
713,0.0,2000000,-2000000.0,"Amusements, gambling, and recreation industries"
721,0.0,0,0.0,Accommodation
722,0.0,0,0.0,Food services and drinking places
811,0.0,1087000000,-1087000000.0,Repair and maintenance
812,0.0,0,0.0,Personal and laundry services
813,0.0,0,0.0,"Religious, grantmaking, civic, professional, and similar organizations"
814,0.0,0,0.0,Private households
GFE,0.0,1000000,-1000000.0,Federal government enterprises
GFGD,0.0,0,0.0,Federal general government (defense)
GFGN,0.0,0,0.0,Federal general government (nondefense)
GSLE,0.0,0,0.0,State and local government enterprises
GSLGE,0.0,0,0.0,State and local government (educational services)
GSLGH,0.0,0,0.0,State and local government (hospitals and health services)
GSLGO,0.0,0,0.0,State and local government (other services)
HSO,0.0,0,0.0,Owner-occupied housing
HST,0.0,0,0.0,Tenant-occupied housing
ORE,0.0,0,0.0,Other real estate
Other,58106303922.0,141572000000,-83465696078.0,Unknown
Used,0.0,7972000000,-7972000000.0,Unknown
